{"packId":"pack-012","schemaVersion":1,"familyCount":20,"families":[{"id":"expression:even-extreme-example","revision":1,"publicationStatus":"verified","difficulty":4,"category":"Grammar: emphasis","intentions":["use an extreme example to strengthen a general claim"],"primary":{"japanese":"専門家でさえ間違えることがあります。","reading":"せんもんかでさえまちがえることがあります。","meaning":"Even experts sometimes make mistakes.","deviceTts":true},"usage":{"summary":"A formal expression used to use an extreme example to strengthen a general claim. The reviewed frame fixes the intended sense and social force rather than treating every literal substitution as safe.","useWhen":["Showing that a surprising person or case is included.","Use the reviewed pattern when you need to use an extreme example to strengthen a general claim."],"avoidWhen":["When the selected example is not actually surprising in context.","Do not transfer the frame to a different relationship or sense without checking register and context."],"suitableRelationships":["Workplace, institutional, public, academic, and ceremonial contexts","Use with audiences who expect formal wording"]},"forms":[{"formId":"reviewed-frame","register":"formal","label":"Formal reviewed frame","japanese":"専門家でさえ間違えることがあります。","reading":"せんもんかでさえまちがえることがあります。","meaning":"Even experts sometimes make mistakes.","deviceTts":true}],"responses":[{"japanese":"本当ですか。","reading":"ほんとうですか。","meaning":"Really?","deviceTts":true}],"followUps":[{"japanese":"詳しく聞かせてください。","reading":"くわしくきかせてください。","meaning":"Please tell me more.","deviceTts":true}],"dialogue":[{"speaker":"A","japanese":"専門家でさえ間違えることがあります。","reading":"せんもんかでさえまちがえることがあります。","meaning":"Even experts sometimes make mistakes.","deviceTts":true},{"speaker":"B","japanese":"本当ですか。","reading":"ほんとうですか。","meaning":"Really?","deviceTts":true}],"patterns":[{"template":"［surprising example］でさえ［result］。","reading":"［surprising example］でさえ［result］。","meaning":"Safe reviewed frame to use an extreme example to strengthen a general claim; replace only the bracketed semantic slot and adjust agreement or inflection as needed.","reviewed":true,"examples":[{"japanese":"専門家でさえ間違えることがあります。","reading":"せんもんかでさえまちがえることがあります。","meaning":"Even experts sometimes make mistakes.","deviceTts":true}]}],"comparisons":[{"expression":"さえ","reading":"さえ","note":"The core particle “even”; でさえ commonly follows nouns in an explicit example frame."}],"searchAliases":["でさえ","Even; as long as only","use an extreme example to strengthen a general claim"],"vocabularyCandidates":[{"written":"でさえ","reading":"でさえ","headwordId":"vocab:2034520"}],"sources":[{"sourceId":"jmdict","locator":"ent_seq 2034520","note":"Licensed candidate identity, readings, senses, and usage flags were checked in the source work queue."},{"sourceId":"kotobank-reference","locator":"https://kotobank.jp/search?q=%E3%81%A7%E3%81%95%E3%81%88","note":"Japanese-language dictionary search used as an independent terminology and family-boundary check; no source prose was copied."},{"sourceId":"original-editorial","locator":"balanced verified batch 2026-09-30-c","note":"Meanings, usage boundaries, warnings, dialogue, comparisons, and safe patterns are independently authored Koto editorial content."}],"review":{"gates":{"source-and-licence":true,"family-deduplication":true,"japanese-naturalness":true,"meaning-and-reading":true,"register-and-social-use":true,"difficulty":true,"substitution-safety":true,"final-publication":true},"reviewedAt":"2026-09-30T17:30:00Z","verifiedAt":"2026-09-30T19:30:00Z","reviewer":"Arena.ai Koto Japanese editorial review","reviewerType":"ai-editorial","notes":"This record passed a source-backed AI editorial pass and a separate final AI Japanese-language pass. Candidate senses, family boundaries, naturalness, readings, contextual meaning, register, social risk, Difficulty, responses, dialogue, comparison, and the constrained substitution frame were checked; no human review is claimed."}},{"id":"expression:as-much-as-possible","revision":1,"publicationStatus":"verified","difficulty":2,"category":"Requests and effort","intentions":["set the greatest practical effort within real limits"],"primary":{"japanese":"できるだけ早く返信してください。","reading":"できるだけはやくへんしんしてください。","meaning":"Please reply as soon as possible.","deviceTts":true},"usage":{"summary":"A neutral expression used to set the greatest practical effort within real limits. The reviewed frame fixes the intended sense and social force rather than treating every literal substitution as safe.","useWhen":["Deadlines, quantity, speed, and requests that allow practical constraints.","Use the reviewed pattern when you need to set the greatest practical effort within real limits."],"avoidWhen":["Pretending flexibility when a strict deadline is actually mandatory.","Do not transfer the frame to a different relationship or sense without checking register and context."],"suitableRelationships":["Friends, peers, and colleagues when the content suits the situation","Polite endings can adapt the frame for unfamiliar adults"]},"forms":[{"formId":"reviewed-frame","register":"neutral","label":"Neutral reviewed frame","japanese":"できるだけ早く返信してください。","reading":"できるだけはやくへんしんしてください。","meaning":"Please reply as soon as possible.","deviceTts":true}],"responses":[{"japanese":"分かりました。そうしてみます。","reading":"わかりました。そうしてみます。","meaning":"I understand. I will try that.","deviceTts":true}],"followUps":[{"japanese":"まず今日から始めます。","reading":"まずきょうからはじめます。","meaning":"I will start today.","deviceTts":true}],"dialogue":[{"speaker":"A","japanese":"できるだけ早く返信してください。","reading":"できるだけはやくへんしんしてください。","meaning":"Please reply as soon as possible.","deviceTts":true},{"speaker":"B","japanese":"分かりました。そうしてみます。","reading":"わかりました。そうしてみます。","meaning":"I understand. I will try that.","deviceTts":true}],"patterns":[{"template":"できるだけ［degree or manner］［action］。","reading":"できるだけ［degree or manner］［action］。","meaning":"Safe reviewed frame to set the greatest practical effort within real limits; replace only the bracketed semantic slot and adjust agreement or inflection as needed.","reviewed":true,"examples":[{"japanese":"できるだけ早く返信してください。","reading":"できるだけはやくへんしんしてください。","meaning":"Please reply as soon as possible.","deviceTts":true}]}],"comparisons":[{"expression":"なるべく","reading":"なるべく","note":"A close “as much as possible,” often slightly softer and more preference-like."}],"searchAliases":["できるだけ","As much or as soon as possible","set the greatest practical effort within real limits"],"vocabularyCandidates":[{"written":"できるだけ","reading":"できるだけ","headwordId":"vocab:1340460"}],"sources":[{"sourceId":"jmdict","locator":"ent_seq 1340460","note":"Licensed candidate identity, readings, senses, and usage flags were checked in the source work queue."},{"sourceId":"kotobank-reference","locator":"https://kotobank.jp/search?q=%E3%81%A7%E3%81%8D%E3%82%8B%E3%81%A0%E3%81%91","note":"Japanese-language dictionary search used as an independent terminology and family-boundary check; no source prose was copied."},{"sourceId":"original-editorial","locator":"balanced verified batch 2026-09-30-c","note":"Meanings, usage boundaries, warnings, dialogue, comparisons, and safe patterns are independently authored Koto editorial content."}],"review":{"gates":{"source-and-licence":true,"family-deduplication":true,"japanese-naturalness":true,"meaning-and-reading":true,"register-and-social-use":true,"difficulty":true,"substitution-safety":true,"final-publication":true},"reviewedAt":"2026-09-30T17:30:00Z","verifiedAt":"2026-09-30T19:30:00Z","reviewer":"Arena.ai Koto Japanese editorial review","reviewerType":"ai-editorial","notes":"This record passed a source-backed AI editorial pass and a separate final AI Japanese-language pass. Candidate senses, family boundaries, naturalness, readings, contextual meaning, register, social risk, Difficulty, responses, dialogue, comparison, and the constrained substitution frame were checked; no human review is claimed."}},{"id":"expression:just-because-does-not-mean","revision":1,"publicationStatus":"verified","difficulty":3,"category":"Grammar: rejected inference","intentions":["reject an unjustified conclusion drawn from one reason"],"primary":{"japanese":"安いからって、必要のない物まで買わないで。","reading":"やすいからって、ひつようのないものまでかわないで。","meaning":"Just because it is cheap, do not buy things you do not need.","deviceTts":true},"usage":{"summary":"A casual expression used to reject an unjustified conclusion drawn from one reason. The reviewed frame fixes the intended sense and social force rather than treating every literal substitution as safe.","useWhen":["Casual warnings and counterexamples where a reason does not guarantee the result.","Use the reviewed pattern when you need to reject an unjustified conclusion drawn from one reason."],"avoidWhen":["Formal writing, where からといって is normally more suitable.","Do not transfer the frame to a different relationship or sense without checking register and context."],"suitableRelationships":["Friends, family, and familiar peers","Use toward others only when the relationship permits direct casual speech"]},"forms":[{"formId":"reviewed-frame","register":"casual","label":"Casual reviewed frame","japanese":"安いからって、必要のない物まで買わないで。","reading":"やすいからって、ひつようのないものまでかわないで。","meaning":"Just because it is cheap, do not buy things you do not need.","deviceTts":true}],"responses":[{"japanese":"それは大変ですね。","reading":"それはたいへんですね。","meaning":"That sounds difficult.","deviceTts":true}],"followUps":[{"japanese":"何かできることはありますか。","reading":"なにかできることはありますか。","meaning":"Is there anything I can do?","deviceTts":true}],"dialogue":[{"speaker":"A","japanese":"安いからって、必要のない物まで買わないで。","reading":"やすいからって、ひつようのないものまでかわないで。","meaning":"Just because it is cheap, do not buy things you do not need.","deviceTts":true},{"speaker":"B","japanese":"それは大変ですね。","reading":"それはたいへんですね。","meaning":"That sounds difficult.","deviceTts":true}],"patterns":[{"template":"［reason］からって、［rejected action or conclusion］。","reading":"［reason］からって、［